<?xml version="1.0" encoding="UTF-8"?>
<socket-configs xmlns="http://www.brent.cn/schema/socketclient" xmlns:xsi="http://www.w3.org/2001/XMLSchema-instance"
	xsi:schemaLocation="http://www.brent.cn/schema/socketclient http://www.brent.cn/schema/socketclient-1.0.xsd">
	
	<socket-short id="test" address="127.0.0.1" port="9008" timeout="30000" retry="1" retryInterval="1000">
		<send charset="UTF-8" />
		<receive charset="UTF-8" processor="cn.brent.socketclient.processor.CloseStreamProcessor"/>
		<msglistener open="false" listener="server.socketshort.MsgProcess"/>
	</socket-short>
	
	<socket-long id="test2" address="127.0.0.1" port="9009" timeout="30000" retry="3" retryInterval="100">
		<heartbeat interval="3000" msg="000000" />
		<pool maxTotal="1"/>
		<send bufferSize="204800" charset="UTF-8"/>
		<receive bufferSize="204800" charset="UTF-8" processor="cn.brent.socketclient.processor.ReadLineProcessor" />
		<msglistener open="true" listener="server.socketshort.MsgProcess" maxRunner="100"/>
	</socket-long>
	
	<socket-long id="head" address="127.0.0.1" port="9010" timeout="30000" retry="3" retryInterval="100">
		<heartbeat interval="30000" msg="00000000" />
		<pool maxTotal="1" />
		<send bufferSize="204800" charset="UTF-8" />
		<receive bufferSize="204800" charset="UTF-8" processor="server.head.HeadProcessor" />
		<msglistener open="true" listener="server.socketshort.MsgProcess" maxRunner="100"/>
	</socket-long>
	
</socket-configs>